title,username,date,upvotes,subreddit
Sea Angels and Sea Butterflies Reveal Climate Change Consequences - The delicate marine animals known as sea angels are facing unprecedented change because of global warming,pnewell,2020-11-30 08:51:38,32,climate
"U.S.’s wettest winter on record is a ‘glimpse of the future under climate change’ -- ""A consequence of global warming is that the extremes around the world increase."" Precipitation records in the winter are precisely what scientists have predicted as climate change intensifies.",therecordcorrected,2019-03-06 22:22:06,157,climate
"A Clash Over Degrees: How Hot Should Nations Allow the Earth to Get? The mantra has been: Limit global warming to 1.5 degrees Celsius or risk climate catastrophe. But at COP27, there are hints of backsliding.",silence7,2022-11-16 11:01:58,7,climate
"How Climate Change Can Supercharge Snowstorms | Less snow is falling in a warming world, but higher temperatures also allow the air to hold more water, creating additional precipitation.",silence7,2022-12-22 17:53:36,265,climate
Most Liberal Democrats Say Global Warming Will Be a Very Important Issue When Deciding for Whom to Vote in the 2018 Congressional Election - Yale Program on Climate Change Communication,ILikeNeurons,2018-08-21 09:00:42,56,climate
"Mountains, Ice and Climate Change: A Recipe for Disasters: Shrinking and thinning of glaciers is one of the most documented signs of the effects of global warming caused by rising levels of greenhouse gases.",silence7,2021-02-08 18:56:02,5,climate
"New Study Says World Must Cut Short-Lived Climate Pollutants as Well as Carbon Dioxide to Meet Paris Agreement Goals | Cutting only CO2 emissions, but failing to rein in methane, HFCs and soot, will speed global warming in the coming decades and only slow it later this century.",silence7,2022-05-24 09:24:19,19,climate
"More than 10,000 people, mostly young people, demanded on Thursday urgent measures to stop climate change during a protest in Brussels. This is the sixth student mobilization in the last month, called to demand from the authorities greater involvement in the fight against global warming.",ClimateBot,2019-02-14 22:34:26,184,climate
UN climate change report: 4 ways smart land use can fight global warming,BlankVerse,2019-08-09 14:38:23,201,climate
"Europe’s climate warming at twice rate of global average, says report | Climate crisis",GeraldKutney,2022-11-02 10:31:11,15,climate
"Facing catastrophic climate change, they still can't quit Big Oil - The region around Nuiqsut, Alaska, has experienced warming more than three times the global average",avogadros_number,2019-12-14 01:25:14,135,climate
"In case of dumb Trump tweet on climate change and snow storms, read this: Global warming is heating the ocean waters that make nor'easters more intense.",therecordcorrected,2018-03-21 21:40:44,79,climate
"Democrats Are Screwing Up the Midterm Climate Message: In a year full of climate disasters wrecking homes and lives, global warming ought to be treated like the kitchen-table issue it is.",thenewrepublic,2022-10-07 10:59:36,11,climate
"5 Things We Know About Climate Change and Hurricanes: Scientists can’t say for sure whether global warming is causing more hurricanes, but they are confident that it’s changing the way storms behave. Here’s how.",silence7,2020-11-10 13:51:45,3,climate
Storebrand dumps oil and mining stocks on climate change lobbying; The asset manager’s divestment fits in a worldwide movement against global warming,silence7,2020-08-25 14:41:02,10,climate
"New Study Shows a Vicious Circle of Climate Change Building on Thickening Layers of Warm Ocean Water: Global warming is deepening blankets of warmer water that alter ocean currents, hinder absorption of carbon, intensify storms and disrupt biological cycles.",silence7,2020-09-29 12:36:57,5,climate
"Photos of Hurricane Ian’s Aftermath in Southwest Florida Illustrate the Coasts’ Growing Climate Risks | As affected residents weigh whether to leave the region, climate scientists stress that the latest extreme weather event, intensified by global warming, was not an anomaly.",silence7,2022-10-17 18:45:02,30,climate
Global Warming-->Climate Change-->Climate Crisis-->Climate Emergency-->??,Youarethebigbang,2020-01-26 02:37:32,2,climate
6 Ways Climate Change Affects the Economy. Global Warming Economics,rmogk21,2019-07-15 18:58:06,24,climate
Charity Commission reviews complaint against climate sceptic thinktank | Move comes after lawyers and MPs raised concerns about charitable status of Global Warming Policy Foundation,silence7,2022-11-21 13:42:46,5,climate
"The Battle Against Global Warming Is the New Cold War: Here's how to mobilize the same federal machinery that gave us Wi-Fi, semiconductors, GPS, and the internet—this time to fight climate change.",cryptoz,2020-04-04 22:07:17,23,climate
Ratcheting of climate pledges needed to limit peak global warming,GeraldKutney,2022-11-11 07:08:29,15,climate
"After the Storm, the Mold: Warming Is Worsening Another Costly Disaster | Mold in homes is a costly crisis that often accompanies hurricanes and flooding, and climate change is amplifying the rain that feeds outbreaks.",silence7,2022-10-04 19:01:40,537,climate
"A worrying number of science textbooks are missing an important topic: When researchers examined 16 of the leading undergraduate science textbooks published between 2013 and 2015, less than 4 percent were devoted to climate change or global warming.",ClimateBot,2018-05-05 17:34:06,48,climate
"House Democrats Plan to Tackle Climate, with or without the GOP - Head of the revamped House climate committee says the panel will be working on a policy road map for global warming. Climate change is back on the table in Congress.",ClimateBot,2019-01-28 13:52:59,130,climate
"Kids are suing Florida governor Rick Scott over climate change: Gov. Scott once reportedly banned officials from saying ""climate change"" or ""global warming"" in government reports.",therecordcorrected,2018-04-16 11:41:55,99,climate
"Americans Will Pay Billions More For Climate Change, and That’s the Best Case | A grim U.S. government assessment of global warming’s economic impacts gives a whole new meaning to Black Friday.",pnewell,2018-11-23 15:24:07,98,climate
Big Australian investors under scrutiny over climate change: Voting records for corporate shareholder resolutions show lack of support for green policies at a time of global warming crisis,silence7,2020-01-18 12:08:57,34,climate
Exposure to the IPCC special report on 1.5 °C global warming is linked to perceived threat and increased concern about climate change,silence7,2019-11-29 07:39:15,46,climate
"The Rate of Global Warming During Next 25 Years Could Be Double What it Was in the Previous 50, a Renowned Climate Scientist Warns",quarry,2022-05-27 01:31:17,346,climate
Here’s Where the U.S. Is Testing a New Response to Climate Hazards | Native American tribes are competing for the first federal grants designed to help relocate communities away from dangers posed by global warming.,silence7,2022-11-02 09:53:10,11,climate
"State of the Union: Trump Glorifies Coal, Shuts Eyes to Climate Risks | Trump talked of the year's climate disasters—without saying 'climate change'—and while repeating his usual promotion of the fossil fuels that drive global warming.",pnewell,2018-01-31 08:25:10,76,climate
"Global Warming Is on the Local Ballot This Year: A new crop of primary challengers is mobilizing voters by pointing to Hurricane Sandy, Lake Mead, and other local climate concerns.",thenewrepublic,2022-06-09 12:41:29,1,climate
Risk of multiple climate tipping points escalates above 1.5°C global warming,Splenda,2022-09-09 13:22:59,16,climate
Global climate data set update reveals greater warming: HADCRUT5 uses techniques similar to GISTEMP to fill in for areas without temperature measurement and correct for changes in how sea surface temperatures are measured. It shows similar results.,silence7,2020-12-15 16:32:58,4,climate
The Global Banker Who's Not Sure the Globe is Warming | Biden's Easiest Climate Call Ever is to Ditch David Malpass,silence7,2022-09-21 14:18:00,159,climate
‘I’m Just More Afraid of Climate Change Than I Am of Prison’ | How a group of five activists called the Valve Turners decided to fight global warming by doing whatever it takes.,pnewell,2018-02-13 08:24:50,45,climate
"As the Planet Cooks, Climate Stalls as a Political Issue | Joe Manchin’s rejection of a compromise climate bill tells a familiar story: Voters and politicians put a higher premium on immediate issues, such as inflation and the economy, giving politicians a pass on global warming.",silence7,2022-07-17 10:25:48,91,climate
Exceeding 1.5°C global warming could trigger multiple climate tipping points – Paper explainer,kytopressler,2022-09-13 18:45:11,21,climate
Dead Birds Washing Up by the Thousands Send a Warning About Climate Change | A new study unravels the mystery of what caused so many of these normally resilient seabirds to starve amid an ocean heat wave fueled in part by global warming.,pnewell,2020-01-16 09:15:16,13,climate
"What Is COP27? And Other Questions About the Big U.N. Climate Summit | With the world still struggling to get global warming under control, diplomats will gather in Egypt for United Nations climate talks. Here are some key facts.",silence7,2022-10-31 09:43:34,7,climate
Changing minds about global warming: vicarious experience predicts self-reported opinion change in the USA,silence7,2022-08-09 10:57:22,11,climate
How global warming and La Niña fueled a summer of climate extremes,wewewawa,2022-09-17 15:56:47,15,climate
How climate change is making hurricanes more dangerous. Since 1975 there has been a substantial and observable regional and global increase in the proportion of Cat 4–5 hurricanes of 25–30 percent per °C of anthropogenic (human-caused) global warming.”,Toadfinger,2019-07-10 05:33:56,41,climate
‘The Human Element’ makes the impacts of climate change feel real A photographer documents how global warming is already affecting people’s lives.,Bumtiki,2019-02-10 02:13:23,62,climate
"Meet the Band of TV Animals That’s Talking to Preschoolers About Climate | There are few books, shows or other tools to help parents and teachers talk to preschoolers about global warming. “Octonauts: Above and Beyond” is one of the first to try.",silence7,2022-10-04 09:31:52,24,climate
"R.I.P. to William Smith Broecker. The Newberry Professor in the Department of Earth and Environmental Sciences at Columbia University, he wrote “Climatic Change: Are We on the Brink of a Pronounced Global Warming?” in August 1975 as a warning for humanity.",ClimateBot,2019-02-19 00:48:24,50,climate
"Earth's fish are disappearing because of climate change, study says: The scientists said they were ""stunned"" to discover that global warming has significantly affected fish stocks worldwide and warned that the decline could threaten the livelihoods and food supplies of millions of people.",therecordcorrected,2019-02-28 15:09:20,43,climate
"Mankind must change its economy to limit global warming. But it is also true that human influence on the climate prevents a no less dangerous ecological catastrophe. If the Fridays for Future movement took this into account, it could gain credibility. A comment.",wilmots1,2019-11-29 00:37:47,5,climate
The Exponential Complexity of Anthropogenic Global Warming & Climate Change,hjras,2019-12-03 05:44:57,0,climate
The real culprit of Global Warming/Climate Change,UnrenderedAsian,2019-05-31 16:30:23,0,climate
"Evidence against global warming, human-induced climate change",l0vebat,2018-05-15 16:01:15,3,climate
Had to clickbait for the first 30 seconds so climate deniers can watch a video about the facts of global warming. We need change NOW!,benfiebs,2020-01-02 18:35:36,5,climate
"Climate change: ‘A moral, ethical and economic imperative’ to slow global warming say UN leaders, calling for more action",yayforjay,2019-05-13 11:41:04,13,climate
Global Warming's Six Americas Ovr Time - Yale Program on Climate Change Communication,ILikeNeurons,2020-10-11 09:06:09,9,climate
Landmark Australian ruling rejects coal mine over global warming - The case is the first time a mine has been refused in the country because of climate change.,ClimateBot,2019-02-11 10:20:28,22,climate
"Second glacier avalanche in a week shows dangers of a warming climate | Rising global temperatures are weakening glaciers in mountainous areas, where millions of people rely on these reservoirs as a source of water",silence7,2022-07-13 10:19:30,32,climate
"Does Trump understand how global warming works? -- Asked whether he and Charles spoke about climate change, Trump said that he wants the United States to have clean air and water. It occurred to me that I’ve never really heard Trump talk about carbon dioxide as a contributor to climate change.",therecordcorrected,2019-06-05 15:24:02,7,climate
"Wealthier people do less in the struggle against climate change, finds a new experiment where participants act collectively against global warming. Those with fewer resources were prepared to contribute significantly more to the public good than wealthier people, sometimes up to twice as much.",ClimateBot,2018-11-06 06:51:13,19,climate
No change to Canadian climate plan as report warns world losing global warming battle,idspispopd,2018-10-07 21:26:44,28,climate
"‘Impossible to ignore’: Why Alaska is crafting a plan to fight climate change. While many conservative-leaning states have resisted aggressive climate policies, Alaska is already seeing the dramatic effects of global warming firsthand, making the issue difficult for local politicians to avoid.",ClimateBot,2018-05-17 03:11:17,39,climate
The crown and climate | Britain has been one of the main contributors to global warming. We look at the new king’s environmental credentials.,silence7,2022-09-13 12:28:51,19,climate
"Global warming 101 - The past, present and future of climate change",silence7,2019-09-24 15:23:40,2,climate
Extreme global weather is 'the face of climate change' says leading scientist: Prof Michael Mann declares the impacts of global warming are now ‘playing out in real-time’,ClimateBot,2018-07-29 13:11:26,30,climate
Global warming 'hiatus' is the climate change myth that refuses to die,rrohbeck,2018-12-19 16:20:52,12,climate
"Emails show cooperation among EPA, climate-change deniers: Newly released emails show senior Environmental Protection Agency officials working closely with a conservative group that dismisses climate change to rally like-minded people for public hearings on science and global warming.",therecordcorrected,2018-05-26 16:19:52,27,climate
is there any photo evidence of global warming comparing old/new photos of places that went under water due to climate change?,Aboly,2019-05-16 13:31:16,0,climate
"Sea Turtle Sanctuary Has Survived 40 Years. Climate Change May Kill It. | Against long odds and initially strong opposition, a pristine marine preserve in the Philippines has thrived for decades under the care of local fishermen. Warming waters threaten the achievement",silence7,2022-11-09 12:03:33,10,climate
Study finds that acceptance and worry about global warming have increased faster among Americans aged 18-34 compared to older Americans #GlobalCarbonFeeAndDividendPetition,Keith_McNeill65,2022-12-15 12:01:51,58,climate
Does this disprove climate change/global warming in any way or is it cherry picking data?,zeca1486,2021-05-11 15:34:11,3,environment
Why do people around me not believe in climate change/ global warming?,broskide,2019-06-06 12:16:15,6,environment
"Climate change, global warming: Grandparents trying to save Earth",plazmagun05,2019-04-24 10:04:06,3,environment
Climate Change: The Gathering Storm,Xenedin,2019-03-27 17:45:03,10,environment
"Headlines and articles in the Guardian, WaPo, and others somehow interpret the recent UN climate report as though we have 10 to 12 years to do something about climate change. We don't.",knowyourbrain,2018-11-29 13:41:17,1,environment
"Nearly two-thirds of Americans think the federal government is not doing enough to fight climate change, according to a new poll that shows limited public awareness about a sweeping new law that commits the U.S. to its largest ever investment to combat global warming.",Wagamaga,2022-10-25 04:40:18,2392,environment
"Scientists have found heatwaves are now occurring far more frequently and are hotter, and some events are happening that would be all but impossible without climate change, with tens of thousands of heat-related deaths a year due to global warming.",Wagamaga,2022-06-28 04:32:10,949,environment
"Bees Grounded, 820 Billion Go Hungry, Food Shortages Coming",CommonEmployment2,2020-04-18 18:17:18,23,environment
"Spending on nature must double in two years to limit warming to 1.5°C. Tackling climate change, biodiversity loss and land degradation with immediate action requires that current global investments need to increase by USD 230 billion each year to 2025",Wagamaga,2022-12-02 14:06:04,45,environment
"Every bit of additional warming will mean even more flooding and catastrophe :The findings from a new study published in the journal Nature Climate Change show that 3.3 percent of Greenland’s ice sheet will melt, causing global sea levels to raise by nearly a foot",ShotWrap8704,2022-09-05 15:18:51,78,environment
Food Is God: James Hansen's Plan To Save Life On Earth,CommonEmployment2,2020-04-28 09:25:16,7,environment
"Climate Change Contributed to Deadly West African Floods, Scientists Find | Amid the ‘loss and damage’ debate at global climate talks, the study adds to evidence that less-developed countries suffer from warming that industrialized nations largely cause.",silence7,2022-11-16 17:10:12,5,environment
"Pace of Climate Change Sends Economists Back to Drawing Board | They underestimated the impact of global warming, and their preferred policy solution floundered in the United States.",silence7,2022-08-25 09:58:55,75,environment
I want to remake Miyazaki’s Nausicaa now,Chrislondo110,2019-02-11 18:09:04,4,environment
"Parts of Antarctica, including the Antarctic Peninsula and West Antarctica, have experienced significant warming over the last 50 years. As climate change raises average global temperatures, marked warming in the polar regions is expected, especially in the winter months.",Wagamaga,2022-10-27 06:56:59,5,environment
Australia’s richest woman Gina Rinehart has said humans do not cause global warming and warned against climate change “propaganda” in a speech to students at her old school,WalkThePlank123,2021-10-07 04:27:17,1771,environment
The Primary Drivers of Ecocide,SuperMax33,2018-12-29 19:39:04,3,environment
"Already feeling the effects of a warming planet, Hawaii has set ambitious goals to combat climate change. But a new report says staving off a worst-case scenario requires global action",Wagamaga,2022-04-10 09:08:16,82,environment
2040: Prognosis Negative,CommonEmployment,2018-04-23 08:20:13,3,environment
Clock is ticking to save East Antarctica from climate change: The worst effects of global warming on the world's largest ice sheet could be avoided if nations around the world succeed in meeting climate targets outlined in the Paris Agreement,ShotWrap8704,2022-08-12 04:53:45,15,environment
"The punishing heatwave that scorched India and Pakistan in March and April was made 30 times more likely by climate change, experts in quantifying the impact of global warming on extreme weather events said in a rapid-response report Monday",DoremusJessup,2022-05-23 15:38:17,73,environment
"Global warming in the pipeline is greater than prior estimates: Eventual global warming due to today's GHG forcing alone -- after slow feedbacks operate -- is about 10°C. Human-made aerosols are a major climate forcing, mainly via their effect on clouds.",HenryCorp,2022-12-14 13:33:20,672,environment
"Europe experienced its hottest summer on record in 2021, while being ravaged by floods, heatwaves and fires, according to a report published Friday by the European Union's Copernicus climate change service, showing that global warming is sharply on the rise.",Wagamaga,2022-04-24 13:25:06,53,environment
An oil company wants to use giant chillers to refreeze the ground that climate change is thawing in order to drill for more oil — which will ultimately accelerate global warming,chicompj,2020-08-18 04:58:14,2193,environment
"The number of cactus species at risk of extinction is likely to increase this century as a result of climate change. Study estimates that, by midcentury, global warming could put 60% of cactus species at greater risk of extinction & approximately 40% are likely to see significant declines. N= 408",Grouchy_Energy_1394,2022-04-17 04:56:29,3,environment
Many Scientists Now Say Global Warming Could Stop Relatively Quickly After Emissions Go to Zero. That’s one of several recent conclusions about climate change that came more sharply into focus in 2020.,Wagamaga,2021-01-03 07:58:07,299,environment
Climate change: IPCC report warns of âirreversibleâ impacts of global warming,goosehgm,2022-02-28 12:39:30,18,environment
Global Warming Turned 2022 Into a ‘Chronicle of Climate Chaos’,YoanB,2022-11-06 11:24:50,111,environment
"Climate Change Brings Serious Health Risks: The World Health Organization (WHO) estimates that global warming and rainfall changes cause the loss of at least 150,000 lives every year.",beareatsfish,2021-12-25 00:09:12,40,environment
Climate change: IPCC report warns of 'irreversible' impacts of global warming,SulaBurmeister27,2022-03-01 07:40:37,15,environment
"Few realistic scenarios left to limit global warming to 1.5°C. Of the over 400 climate scenarios assessed in the 1.5°C report by the Intergovernmental Panel on Climate Change (IPCC), only about 50 scenarios avoid significantly overshooting 1.5°C.",Wagamaga,2021-05-14 08:44:54,118,environment
"House Democrats Plan to Tackle Climate, with or without the GOP - Head of the revamped House climate committee says the panel will be working on a policy road map for global warming. Climate change is back on the table in Congress.",mvea,2019-01-28 07:02:23,5742,environment
Climate change: IPCC report warns of ‘irreversible’ impacts of global warming,deron666,2022-02-28 10:53:34,10,environment
"Nearly 200 nations approved a major UN climate change report detailing the accelerating impacts of global warming on Sunday, at the end of a sometimes fraught two-week meeting overshadowed by Russia's invasion of Ukraine.",Wagamaga,2022-02-28 06:28:20,10,environment
"For more than half a century, ExxonMobil has denied and downplayed climate change, has refused any responsibility for global warming and continues to fund groups spreading misinformation. Now, the company is facing the first public hearing on climate change denialism.",Wagamaga,2019-04-25 07:13:22,3098,environment
"Wealthier people do less in the struggle against climate change, finds a new experiment where participants act collectively against global warming. Those with fewer resources were prepared to contribute significantly more to the public good than wealthier people, sometimes up to twice as much.",mvea,2018-11-06 05:46:30,3434,environment
"As climate change costs mount, Biden seeks to price damages | Economists say the costs of climate change are growing as global warming happens more quickly than expected and its impacts become better understood -- from crop losses due to drought, to lessened worker productivity because of the heat",pnewell,2022-02-24 09:06:17,5,environment
"""Untold human suffering"" is in the near future as U.N. warns climate change is pushing Earth closer to extreme warming",AmethystOrator,2022-10-27 14:29:16,2932,environment
"Global warming is already affecting people's health so much that emergency action on climate change cannot be put on hold while the world deals with the Covid-19 pandemic, medical journals across the globe warned on Monday",DoremusJessup,2021-09-05 20:18:57,34,environment
"Climate change forcing Zimbabwean girls into sex work | As global warming continues to devastate rural agriculture, young women are moving to urban centres – and into prostitution.",pnewell,2022-02-15 09:02:23,4,environment
Climate groups called Wednesday for the World Bank's president to be removed after he refused multiple times to say if he believed man-made emissions contributed to global warming,DoremusJessup,2022-09-21 18:58:33,4026,environment
"5 ways climate change made life more expensive in 2022 From grocery bills to insurance premiums, warming temperatures hit Americans' wallets hard this year.",prohb,2022-12-23 09:19:41,441,environment
"Sep 12, 2021 - Mudslide on scenic Colorado highway tests limits of aging infrastructure in era of climate change: Interstate 70 through Glenwood Canyon was built decades before global warming was top of mind...",DomPachino,2021-09-12 14:30:35,37,environment
"Pope Francis on Friday repeated his calls for governments around the world to take action to reduce global warming, warning that climate change is threatening to turn Earth into a pile of rubble.",Wagamaga,2018-07-06 10:39:36,2440,environment
Global warming overshoots increase risks of climate tipping cascades in a network model - Nature,233C,2022-12-26 13:09:50,101,environment
"Democrats Are Screwing Up the Midterm Climate Message: In a year full of climate disasters wrecking homes and lives, global warming ought to be treated like the kitchen-table issue it is.",Splenda,2022-10-07 17:13:56,1127,environment
