title,username,date,upvotes,subreddit
"The Arctic Is Shifting to a New Climate Because of Global Warming: Open water and rain, rather than ice and snow, are becoming typical of the region, a new study has found",mubukugrappa,2020-09-15 16:19:31,41,globalwarming
Elon musk on global warming and what you can do as an individual to help the climate crisis before the eco system completely collapses and mass extinction occurs. To put it quite bluntly.,imit8ted,2020-01-24 08:09:46,27,globalwarming
ILST Ghengis Khan slowed global warming,theseusptosis,2021-09-12 23:15:44,17,globalwarming
Republicans warn Powell about Fed plans for climate regulation: The organized pushback is a preview of what financial agencies face as they begin to address economic fallout from global warming.,LudovicoSpecs,2020-12-12 09:46:53,6,globalwarming
This is what it takes to end global warming. Imagine if every climate activist did this!,jason14331,2020-11-05 11:58:54,8,globalwarming
True terror: Ten worst things climate change will soon deliver to our world,quarry,2022-05-10 10:35:05,16,globalwarming
"More Bullshit!!! ""European cities will be sunk beneath rising seas as Britain is plunged into a 'Siberian' climate by 2020!"" Global Warming is a SCAM!",RealHalKitzmiller,2019-12-27 17:45:04,0,globalwarming
Global Warming,Abdullah-Kaplan,2022-02-09 04:34:08,7,globalwarming
Timeline for Global Warming being a known issue. 1859 - 2021,Kn0tnatural,2021-02-17 11:35:31,23,globalwarming
how can you actually stop global warming?,icecreamlvr5,2019-09-12 09:16:14,24,globalwarming
High-fidelity record of Earth’s climate history puts current changes in context: A continuous record of the past 66 million years shows natural climate variability due to changes in Earth’s orbit around the sun is much smaller than projected future warming due to greenhouse gas emissions,mubukugrappa,2020-09-11 04:45:27,20,globalwarming
Is going Vegan the best thing you can do to prevent climate change?,UnCommonSense99,2021-05-09 06:46:05,17,globalwarming
Global warming skepticism,rickturpentine,2020-03-01 05:22:49,15,globalwarming
Japan is experiencing severer effects of the global warming. 2C up already.,tawago,2019-06-03 02:48:33,53,globalwarming
Fighting climate change,bigbuie23,2019-08-18 22:23:29,8,globalwarming
"They're not ""climate deniers""",TrueConservative001,2022-09-29 09:36:59,22,globalwarming
Climate change: Warming threatens Himalayan glaciers,boppinmule,2019-02-04 14:22:02,14,globalwarming
A problem with individual action on climate change,hn-mc,2021-01-25 20:23:52,4,globalwarming
Does the hiatus in sea temperature expected rising nullify the anthropogenic global warming stance?,Lukerationist,2019-09-20 08:34:41,10,globalwarming
Global Warming is FAKE,1minfact,2020-07-15 20:24:50,0,globalwarming
How do I prove a boomer wrong about climate change not being real?,Justaquestiindhjd,2020-02-20 16:40:42,21,globalwarming
Climate change: Warming gas concentrations at new record high,boppinmule,2018-11-22 11:23:04,10,globalwarming
CURE FOR GLOBAL WARMING,MakeMeCoochieMan,2020-10-20 02:30:45,0,globalwarming
‘Apocalyptic skies’: the dust storms devastating Gulf states and Syria | Climate crisis,TrueConservative001,2022-06-03 23:01:09,13,globalwarming
Let's end the ignorance on plastics contribution to global warming.,walkthroughspace,2019-05-06 15:01:45,25,globalwarming
World Leadership on Global Warming,SharadMandale,2021-06-17 10:50:40,6,globalwarming
Prove human-induced global warming,ramziabbyad,2018-10-18 21:06:19,5,globalwarming
I’m doing an argumentative essay on why you should believe climate change is occurring.,catn890,2019-03-01 15:44:16,12,globalwarming
[Civil Discussion] Help convince me Global Warming is a significant issue.,Corksters,2018-12-04 04:56:36,2,globalwarming
Work is the cause of Global warming,solalbog,2018-07-28 08:24:21,2,globalwarming
2020 predictions by climate change scientists,jogabot,2019-09-12 01:18:17,11,globalwarming
Nature's Solution to Climate Change...Whales?,Silent_Gamerz,2019-11-16 20:28:38,13,globalwarming
Tackling global warming via community,gors6607,2021-02-25 04:46:16,8,globalwarming
Would this sort the CO2/climate problem and why not?,fkid123,2022-09-01 00:09:23,3,globalwarming
Needed: Global Warming Scientist to consult on Sci-Fi novel,chunkythyme,2020-09-24 20:53:42,1,globalwarming
Asking about info for how well/poorly companies and governments are working against global warming,drykeon,2020-01-07 10:31:21,2,globalwarming
I think this current political climate is effecting the actual climate.,borgheses,2022-01-23 12:40:08,16,globalwarming
something doesnt add up here,SilverPerformer3106,2022-08-28 19:25:08,4,globalwarming
Startups working in Climate Tech!,thesamotar,2021-08-05 12:59:47,19,globalwarming
I did the *simple* math,Solkidsol,2022-06-04 05:02:09,5,globalwarming
Do seaweed farms actually help?,meido_zgs,2022-04-12 14:39:34,16,globalwarming
Grass found growing around Mount Everest as warming climate melts ice,GlobalWFundfEP,2020-01-11 23:33:57,7,globalwarming
Warming Climate Is Driving Species Loss,nexus232,2018-07-31 18:29:44,7,globalwarming
Mowe your lawn less and help the planet,transspouselove,2022-07-18 18:33:16,24,globalwarming
Is there any climate catastrophe big enough to shock humanity into real action? Here are 3 possibilities,MarshallBrain,2022-06-29 05:54:19,23,globalwarming
Petition.,Comfortable-Log-186,2021-09-08 20:01:24,8,globalwarming
A forgotten Cold War experiment has revealed its icy secret. It’s bad news for the planet.,billypennsballs,2021-03-17 08:38:34,23,globalwarming
I just want to point something out.,PointlessAccount_lol,2019-10-06 15:58:09,13,globalwarming
Can we freeze water with radiation,Glacier_nut_9000,2022-07-30 21:06:43,3,globalwarming
Argument for teacher.,El_quacko17,2019-10-08 23:56:58,4,globalwarming
Data fabrication on IPCC 2018 Summary for Policymakers page 6?!,songbolt,2018-11-24 18:27:31,0,globalwarming
"If the Hardiest Species Were Boiled Alive in PNW Heatwave, What Happens to Humans?",JaydenSmoth,2021-07-31 20:21:25,18,globalwarming
Why would we listen to her?,JayDee22x,2021-04-23 02:32:32,1,globalwarming
Something to think about.,leeinleeout1,2019-09-30 09:37:56,0,globalwarming
I made a list of what I've done and what I'm planning to do to help the environment. Any criticism or additional items are welcome.,Squeegee_House,2019-08-14 15:37:26,21,globalwarming
Plastics Industry: Worse than Tobacco,sjscott77,2020-11-28 17:00:08,28,globalwarming
Carbon Tax to fund green living,Tobias_Muldoon,2019-06-04 23:07:15,6,globalwarming
"The Fed Is Neglecting Its Duty on Climate Change: Global warming is introducing unprecedented risk into the financial system. The Fed has the power to limit that risk. Instead, Jerome Powell is sitting on his hands.",thenewrepublic,2022-05-19 15:48:56,109,climate
Reads I’ve saved on Climate Change/global warming!,TooneyChaos,2021-12-16 15:41:42,4,climate
Is there a central place/sources where I can find evidenced based information about climate change (global warming)?,Boogie778,2019-04-23 04:28:28,2,climate
"Climate change, global warming: Grandparents trying to save Earth",Kunphen,2019-04-28 14:41:19,4,climate
"Climate change, Global warming.",Pikk_Ax,2018-11-07 17:30:41,3,climate
climate change awareness music video,Airlinefightclub,2022-04-20 21:23:22,0,climate
How are you handling your complicity in climate genocide?,metal_fanatic,2022-05-06 07:56:44,120,climate
Can someone more knowledgeable on climate change than me elaborate on what is wrong with this cherry picked data?,NickFromNewGirl,2018-05-17 13:20:20,1,climate
"A ‘Once in a Generation’ Storm. What’s the Role of Climate Change? The deadly freeze that swept the United States was extraordinary, but while scientists know that global warming can intensify extreme weather, the effects on winter storms are tricky to untangle.",silence7,2022-12-28 14:18:50,619,climate
"should ExxonMobil be somehow held liable for global climate change? If so, to whom specifically? And how might damages be calculated? Who should be the recipients of any money they might have to pay? Who else should be held responsible for global warming",Quiet_Hovercraft1709,2022-12-13 17:14:14,430,climate
"Climate Change Contributed to Deadly West African Floods, Scientists Find | Amid the ‘loss and damage’ debate at global climate talks, the study adds to evidence that less-developed countries suffer from warming that industrialized nations largely cause.",silence7,2022-11-16 17:09:49,297,climate
"Is climate change triggering extreme cold? The debate is super hot. | Research suggests that global warming is altering the jet stream, pushing Arctic air down to southern climes more frequently. But the scientific jury is still out.",silence7,2022-12-23 12:42:40,140,climate
"Five countries have cost the world $6 trillion in global warming losses | Climate change is causing substantial economic damage, recent research finds.",silence7,2022-11-21 11:02:36,181,climate
How Do I Continue to Do My Part for the Environment Without Giving into Doom and Gloom?,KeySquirrelTree,2020-09-17 14:15:33,19,climate
"In a First Study of Pakistan’s Floods, Scientists See Climate Change at Work | A growing field called attribution science is helping researchers rapidly assess the links between global warming and weather disasters.",silence7,2022-09-15 21:50:47,795,climate
"At COP 27, an artist asks attendees to feel climate change — literally | Bahia Shehab’s “Heaven and Hell in the Anthropocene” is an immersive installation that invites visitors to think about global warming with their bodies",silence7,2022-11-12 21:02:11,124,climate
"China drought highlights economic damage wrought by global warming - Record heatwave behind power shortages that paralysed industry probably caused by climate change, scientists say",fungussa,2022-09-01 06:47:46,69,climate
"Climate Change in the American Mind | A majority of Americans (55%) understand that most scientists think global warming is happening. However, only one in five (20%) understand how strong the level of consensus among scientists is",silence7,2022-07-21 11:38:58,77,climate
Global Warming: What Can You Do To Stop Man Made Climatic Change?,Affectionate_Bet_793,2022-10-05 19:21:38,2,climate
2040: Prognosis Negative,CommonEmployment,2018-04-23 08:21:22,7,climate
"France’s unprecedented drought shows climate change is ‘spiralling out of control’. As global warming accelerates, the spectre of drought haunts France’s once verdant farmland. Even now, before the start of",GoMx808-0,2022-05-13 13:37:58,130,climate
The surprising political shifts that led to the US climate bill’s passage | The bill’s success shows how the politics of climate change have shifted profoundly since scientists began warning about global warming,silence7,2022-08-13 10:04:16,8,climate
"Severe Indian heatwave will bake a billion people and damage crops | The recent heat is likely to have been exacerbated by climate change, says Mondal, though it is too early for any specific research attributing the event to global warming.",silence7,2022-04-27 10:29:26,9,climate
"Global ‘Stilling’: Is Climate Change Slowing Down the Wind? As carbon dioxide levels rise and the Earth’s poles warm, researchers are predicting a decline in the planet’s wind speeds.",silence7,2022-09-13 10:11:24,21,climate
"New Climate Promises, Same Old Global Warming | But while saving the planet demands something more ambitious than good old incremental change, these corporate fantasies of the future don’t stand up to scrutiny.",silence7,2022-07-12 09:41:56,6,climate
"Climate Change Worsened Britain’s Heat Wave, Scientists Find | Scorchers like the one last week are still unusual, but global warming is making them more likely, and worse when they do strike.",silence7,2022-07-29 11:36:35,2,climate
"Climate Change Batters the Western US Before Summer Even Begins: Global warming has been fueling disasters in the region for years. Now, an early heat wave and severe drought are threatening lives and leaving water in perilously short supply.",silence7,2021-06-17 08:33:43,400,climate
Climate change: IPCC report warns of ‘irreversible’ impacts of global warming,michaelrch,2022-02-28 08:32:05,28,climate
"Climate Change Brings Serious Health Risks | The World Health Organization (WHO) estimates that global warming and rainfall changes cause the loss of at least 150,000 lives every year. | This figure could increase significantly if current trends of climate change continue.",silence7,2021-12-25 10:22:06,129,climate
Do you think that Global Warming/Climate Change will stop before we hit a breaking point?,unimportantsarcasm,2021-07-31 18:59:55,37,climate
The Climate Tipping Points: How global warming may trigger irreversible changes to our planet. - BBC Radio 4 Available Episodes,coolbern,2022-06-08 09:50:34,20,climate
Is climate change amping up the Pacific Northwest heat wave? Yes — and it’s time to stop asking. Scientists say the burden of proof has shifted for connecting heat waves and global warming.,sportsfanatic61,2021-07-04 12:23:49,315,climate
The Thorny Ethics of Historic Preservation in the Age of Climate Change: Can we preserve ancient monuments without losing sight of what global warming is doing to humans living today?,thenewrepublic,2022-04-28 12:48:53,5,climate
What are the 8 most dangerous things most people do not understand about climate change & global warming,coolbern,2021-11-19 18:05:45,24,climate
A Third of Americans Faced Extreme Weather in Recent Years | Attitudes about climate change were closely associated with personal experience with an extreme weather event. Sixty-three percent of those who had been affected by extreme weather said they worried “a great deal” about global warming,silence7,2022-04-07 12:18:23,9,climate
"Stopping Climate Change Is Doable, but Time Is Short, U.N. Panel Warns | A major new scientific report offers a road map for how countries can limit global warming, but warns that the margin for error is vanishingly small.",silence7,2022-04-04 11:06:34,9,climate
"After a Trump-length pause, the EPA is relaunching a major climate change report - Drawing on data from 50 government agencies, the EPA has published 54 indicators of global warming.",pnewell,2021-05-14 09:00:01,387,climate
"In the Infrastructure Bill, a Recognition: Climate Change Is a Crisis | For the first time, both parties have acknowledged — by their actions, if not their words — that the United States is unprepared for global warming and will need huge amounts of cash to cope.",silence7,2021-08-03 18:06:14,112,climate
The Answer to Climate Change Is Organizing | Dealing with global warming is always going to be about the balance of power.,silence7,2021-09-02 09:15:39,79,climate
"""Every tenth of a degree counts. We must do what we can to limit global warming as quickly as possible."" – Ricarda Winkelmann, Potsdam Institute for Climate Impact Research #GlobalCarbonFeeAndDividendPetition",Keith_McNeill65,2022-12-24 11:05:28,470,climate
"As climate change costs mount, Biden seeks to price damages | Economists say the costs of climate change are growing as global warming happens more quickly than expected and its impacts become better understood -- from crop losses due to drought, to lessened worker productivity because of the heat",pnewell,2022-02-24 09:06:27,15,climate
"Technology Solution For Climate Change And Global Warming, Check'em Out",lukemendess,2022-03-23 16:42:43,4,climate
"This Decade Has Been the Warmest Decade on Record. Climate change is real, and global warming is proof of it. According to the World Meteorological Organization (WMO), this decade—2011 to 2020—is now the warmest decade on record, with the six warmest years all occurring within the last six years.",Facerealityalready,2020-12-30 07:23:58,459,climate
More Than 30 Countries Join U.S. Pledge to Slash Methane Emissions | Methane is the second largest driver of global warming after carbon dioxide emissions. Scientists say the promised cuts could help avert the worst consequences of climate change.,silence7,2021-10-11 13:50:13,10,climate
"Climate change forcing Zimbabwean girls into sex work | As global warming continues to devastate rural agriculture, young women are moving to urban centres – and into prostitution.",pnewell,2022-02-15 09:02:34,7,climate
"Biden Opens New Federal Office for Climate Change, Health and Equity | The office will be the first government effort to focus specifically on the public health dangers of global warming.",silence7,2021-08-30 13:48:59,131,climate
"Americans think tech companies are key to solving climate change | They’re also concerned about how global warming could impact the industry, from the supply chain to innovation.",silence7,2022-03-17 15:54:41,1,climate
20 Nations at High Risk From Global Warming Might Halt Debt Payments | The countries want their collective $685 billion in debts forgiven so the money can be invested in climate projects.,silence7,2022-10-14 17:49:27,27,climate
Temporarily overshooting the climate targets of 1.5-2 degrees Celsius could increase the tipping risk of several Earth system elements by more than 70 percent compared to keeping global warming in line with the United Nations Paris Agreement range,silence7,2022-12-22 12:38:25,102,climate
"At least 85 percent of the world’s population has been affected by human-induced climate change, new study shows | Researchers used machine learning to analyze more than 100,000 studies of weather events and found four-fifths of the world’s land area has suffered impacts linked to global warming",silence7,2021-10-11 17:14:27,20,climate
"Haven’t We Moved Past the “Raising Awareness” Stage of the Climate Fight? Activists have been defacing artwork to draw attention to global warming. But what we really need are solutions, displays of mass power, and the public humiliation of all who stand in the way.",silence7,2022-10-31 10:56:27,302,climate
"The Energy Department Hails a Breakthrough in Fusion Energy, Achieving a Net Energy Gain With Livermore’s Vast Laser Array. Climate scientists, meanwhile, expressed interest but said the breakthrough must not deter the world’s ongoing quest to counter global warming.",michaelrch,2022-12-17 13:11:31,114,climate
A second Trump political appointee who questions the seriousness of global warming has been assigned a key role in the program that oversees the federal government’s definitive report on climate change.,silence7,2020-11-13 20:28:27,250,climate
Global Conservatives and the Myth of a Climate Change Debate. The “debate” over climate change is a myth that conservative leaders must cease to perpetuate. Overwhelming scientific consensus affirms that the earth is warming at historic rates. Claims to the contrary are not a valid political opinion,solar-cabin,2021-03-23 12:21:04,83,climate
Thousands call for ‘climate reparations and justice’ in global protests | Fridays for Future ‘strikes’ in about 450 places demanded rich countries pay for damage from global warming,silence7,2022-09-23 13:43:28,36,climate
"As climate change takes hold, the need to combat global warming only builds",Splenda,2021-04-20 12:16:33,51,climate
"The unholy alliance of covid-19, nationalism, and climate change- When the pandemic wanes, a poorer, more divided world will still face the rapidly rising threat of global warming.",pnewell,2020-04-13 09:07:34,441,climate
"Minnesota Alleges ExxonMobil, Koch and API Deceived Public About Climate Change | The state’s lawsuit seeks damages related to global warming under statutes prohibiting consumer fraud, deceptive trade practices and false advertising.",pnewell,2020-06-25 08:50:58,369,climate
"""Can a new fuel solve climate change"" analysis of global warming and a theoretical proposal of using fossil fuels without greenhouse gasses emissions (with bonus ocean accicidity reduction)",Franz_the_clicker,2021-12-20 14:04:36,1,climate
The Racial Violence of Climate Change | It’s time to speak plainly about the deadly effects of global warming—and their unjust impact across racial lines.,silence7,2021-08-17 19:31:03,28,climate
"The strong winds of climate change have failed to move the opinions of many Americans- Most believe global warming is a problem, but the partisan divide is growing",pnewell,2021-11-12 09:55:34,4,climate
US Voters Finally Want Candidates To Act on Climate Change: Recent polling finds that clear majorities favor federal action on global warming,silence7,2020-10-26 13:13:51,33,climate
"The man who advised the GOP to drop “global warming” for the less scary-sounding “climate change” now calls for climate action. “I’m here before you to say that I was wrong in 2001. Just stop using something that I wrote 18 years ago, because it’s not accurate today.”",fungussa,2019-08-11 08:44:07,401,climate
The world is missing its lofty climate targets. Time for some realism - Global warming cannot be limited to 1.5°C.,mattematik,2022-11-07 08:10:22,130,climate
"On a Pacific Island, Russia Tests Its Battle Plan for Climate Change | President Vladimir V. Putin long dismissed the threat posed by global warming. But fires, disasters and foreign pressure have prompted him to change course.",silence7,2021-10-19 18:07:43,3,climate
"Breitbart article makes numerous false claims about the impacts of climate change, based on Global Warming Policy Foundation post",gmb92,2021-02-24 12:07:34,20,climate
"In a Reversal, the U.S. Won’t Block Climate Compensation for Poor Nations | A U.S. official said negotiations continue over details for a fund to help developing countries cope with “loss and damage” caused by global warming.",silence7,2022-11-19 13:51:52,312,climate
Junk Carbon Offsets Are What Make These Big Companies ‘Carbon Neutral’ | Dozens of the biggest global companies — from banks to industrial heavyweights — have made bold climate claims justified by cheap renewable-energy offsets that don’t counteract global warming,silence7,2022-11-21 10:23:05,356,climate
Beyond Google: my afternoon trawling Trove for the first mentions of climate change; What happens when you decide to search the National Library database for historical references to global warming? It goes further back than you think,silence7,2020-06-28 09:50:30,110,climate
"Trump thinks scientists are split on climate change. So do most Americans - There’s a 97% expert consensus on human-caused global warming, but most Americans are unaware",ClimateBot,2018-10-22 09:46:49,305,climate
"Americans’ climate change concerns surge to record levels, poll shows - Total of 72% polled now say global warming is personally important to them, Yale said, as 73% accept it is happening",pnewell,2019-01-23 08:55:06,290,climate
"As The Climate Crisis Intensifies, Trump Digs In On Denial | From declaring global warming will magically reverse itself to tapping two climate change contrarians for top scientific posts, Trump remains an ostrich.",pnewell,2020-09-24 09:18:30,32,climate
Is climate change amping up the PNW heat wave? Yes — and it’s time to stop asking. Scientists say the burden of proof has shifted for connecting heat waves and global warming.,silence7,2021-06-29 09:57:00,4,climate
Exceeding 1.5°C global warming could trigger multiple climate tipping points,GeraldKutney,2022-09-08 17:02:42,88,climate
"""Generally, if humans are the primary cause of a globally warming climate, that means we can also be the architects of its undoing."" – Patrick Omeja, Makerere University, Uganda #GlobalCarbonFeeAndDividendPetition",Keith_McNeill65,2022-12-20 10:24:23,25,climate
"Alexandria Ocasio-Cortez grills former Exxon scientists on oil giant's climate change denial: Rep. @AOC: Exxon accurately predicted future global warming in 1982, correct? Former Exxon consultant turned whistleblower: “We were excellent scientists.”",GlobalClimateChange,2019-10-26 15:16:53,150,climate
"D-Day shows how to fight climate change - If the world had responded to the Nazis the way we are responding to global warming, Hitler would have won.",pnewell,2019-06-06 09:48:50,124,climate
An oil company wants to use giant chillers to refreeze the ground that climate change is thawing in order to drill for more oil — which will ultimately accelerate global warming,stankmanly,2020-08-18 09:25:34,52,climate
"Early oil industry disinformation on global warming: A newly discovered archival document shows the American Petroleum Institute was promulgating false and misleading information about climate change in 1980, nearly a decade earlier than previously known",silence7,2021-01-06 12:06:14,28,climate
Trump confuses weather with climate change again: 'Wouldn’t be bad to have a little good old fashioned Global Warming right now!',ClimateBot,2019-01-20 23:19:14,196,climate
"Humans cannot expect a safer, cooler world from geoengineering. The only sure way to slow dangerous global warming and climate change is to cut greenhouse gas emissions.",silence7,2018-11-01 10:27:06,72,climate
How 19th Century Scientists Predicted Global Warming - Today’s headlines make climate change seem like a recent discovery. But Eunice Newton Foote and others have been piecing it together for centuries.,avogadros_number,2019-12-24 13:29:14,178,climate
"Pakistan floods revive a debate: Should U.S. pay for climate disasters? Even as Pakistan turns to donors around the world asking aid to cope with deadly and costly flooding, many politicians and activists demand the United States and others compensate poor nations for global warming damages",silence7,2022-08-29 19:03:42,61,climate
