title,username,date,upvotes,subreddit
This is how many trees we would need to fix climate change/global warming (Money and space included),R2_XD_,2021-11-30 19:14:25,6,climatechange
Some interesting reads I found surrounding climate change/global warming,TooneyChaos,2021-12-13 19:56:42,6,climatechange
I’m 100% that climate change/global warming is real and man made. But I have no idea how to respond when someone asks why it’s so cold right now.,shroomalatians316,2019-01-29 15:54:12,43,climatechange
Here’s a Mega-List of reputable sources proving climate change is very real.,TheJoshWatson,2019-10-27 18:59:04,162,climatechange
Can anyone recommend a list of companies who are solving climate change issue?,kuttippa,2021-02-21 10:05:25,4,climatechange
Is climate change getting better? Or worse..,Venus_mar07,2020-07-15 09:38:43,5,climatechange
I have lost all hope -- we are heading for disaster and nobody seems to care (long post),climateimpact827,2020-10-04 14:13:15,14,climatechange
can someone give me some information?,offtherails33,2021-09-11 13:17:41,5,climatechange
Go Gang Green!!!,saywhaa_sayyeah,2021-09-05 13:47:33,0,climatechange
"If 97% of scientists agree that global warming is mainly human-driven, are future debates about climate change worth having?",AcquiescentAxolotl,2022-04-11 23:56:34,85,climatechange
Climate change: IPCC report warns of ‘irreversible’ impacts of global warming,boppinmule,2022-02-28 07:39:46,123,climatechange
Western Ghats; Thoughts on Climate Change and Global Warming - LOST ON HISTORY,dk987,2022-07-04 02:18:20,2,climatechange
When did you first hear of climate change or global warming?,FunnayMurray,2021-08-10 23:01:41,12,climatechange
Is there such a thing as climate change believers who don’t believe in global warming and are anti-green?? (+anecdote),TooneyChaos,2021-09-28 14:38:17,6,climatechange
How are global warming and more extreme cold weather events due to climate change happening at the same time?,SeifHadaba,2021-02-22 05:28:20,36,climatechange
"Technology Solution For Climate Change And Global Warming, Check'em Out",lukemendess,2022-03-23 16:44:14,0,climatechange
"""Global Warming"" vs. ""Climate Change"" - Google search trends over the last 10 years",Unitmonster555,2020-07-10 13:31:20,118,climatechange
"""Global Warming"" vs. ""Climate Change"" in the scientific literature",kytopressler,2020-07-10 14:58:30,14,climatechange
What’s a good summary of the impacts of climate change at various levels of warming?,Particular_Shift_800,2022-12-22 03:11:34,15,climatechange
New Research on Climate Change Persuasion: Addressing Global Warming Denialism | Public Opinion Quarterly,ketoresearcher,2020-10-28 18:42:03,8,climatechange
Permafrost and Climate Change: Carbon Cycle Feedbacks From the Warming Arctic,kytopressler,2022-10-20 15:52:05,19,climatechange
Groundwater reserves in Africa may be more resilient to climate change than first thought - “global warming is making rainfall come in fewer but heavier bursts – that could actually be good for increasing groundwater recharge overall”,technologyisnatural,2019-08-14 14:43:41,79,climatechange
Equip me in the debate on global warming,ElonYo,2022-10-12 16:40:41,482,climatechange
"Climate change is poised to raise the risk of global conflict, including riots and civil war, by 14% for every degree of warming. It's knock-on effect — declining crop yields, rising food prices, depleting water systems — threatens political and economic stability.",Climate_orgs,2020-11-17 13:35:44,24,climatechange
"Is climate change because of C02 from cars, deforestation, or both? If C02 helps plants grow, Couldn't we dispense with all the new taxes, and just tweak our trees grown to killed ratio? I don't have a science background, so I am also curious if other planets have climate change or global warming.",R33K0h,2019-01-15 19:41:43,10,climatechange
Exceeding 1.5°C global warming could trigger multiple climate tipping points – paper explainer,kytopressler,2022-09-13 18:38:28,84,climatechange
"Expert Review of The Intergovernmental Panel on Climate Change (IPCC) 2019 Special Report Global Warming of 1.5° C Chapter 2, “Mitigation . . . ”",cctruth,2019-11-19 23:25:36,0,climatechange
Was Global Warming Data 'Faked' to 'Fit Climate Change Fictions'?,Freeze95,2019-10-14 13:05:26,1,climatechange
Is the evidence for climate change different from the evidence for global warming?,jackryan147,2020-01-05 21:26:47,0,climatechange
Climate change is no more just some hypothesis on how nature reacts to heat and is now being felt across the world but science still reveals contradictory results ... a new study that contradicts the evidence on the effect of global warming on the Adriatic Sea,versionverte,2020-09-04 07:51:18,2,climatechange
How do I convince a friend that the earth is warming up due to climate change and not because the earth is tilting/changing its angles?,ShotOwnFoot,2022-08-02 00:20:49,46,climatechange
Global Warming Trends After Late CO2 Peak?,isbtegsm,2022-11-30 06:38:44,12,climatechange
Shouldn't global warming reduce deserts?,Bath_Toaster,2022-10-10 16:55:39,10,climatechange
Started a geology class - teacher denies global warming?,Humble-Giant,2022-08-30 13:53:50,75,climatechange
Are we only postponing global warming?,fictionalguyy,2022-11-04 14:01:12,2,climatechange
Climate change: UN warns key warming threshold slipping from sight,Kagedeah,2022-10-27 08:48:58,50,climatechange
How to argue the severity of climate change?,jlspace,2022-11-29 22:24:46,8,climatechange
"Looking for rational debates, books, and papers from climate change DENIERS",moblobby,2022-12-11 21:34:40,0,climatechange
Climate change: Fifty-fifty chance of breaching 1.5C warming limit,Kagedeah,2022-05-10 06:56:08,105,climatechange
Record Cold Forecast and Climate Change?,Galtha58,2022-12-22 01:39:00,3,climatechange
Climate change: IPCC scientists say it's 'now or never' to limit warming,adinaespinoza,2022-04-04 19:49:36,127,climatechange
"This would be massive in global warming, Why does no one do it?",ChargedStork,2022-10-08 10:28:02,0,climatechange
Climate Change - Help with an argument...,inYOUReye,2022-10-31 05:11:55,22,climatechange
The Impact of Climate Change on Biodiversity and the Struggle for Survival,JackONeill23,2022-12-14 13:58:48,8,climatechange
"Global Warming Accelerates Water Cycle, With Relevant Climatic Consequences",51lverb1rd,2022-04-30 10:09:14,60,climatechange
High-fidelity record of Earth’s climate history puts current changes in context: A continuous record of the past 66 million years shows natural climate variability due to changes in Earth’s orbit around the sun is much smaller than projected future warming due to greenhouse gas emissions,mubukugrappa,2020-09-11 04:45:21,74,climatechange
Artificial Snow Coverage to counter climate change. Is this practical? Anyplace try it?,HeyUKidsGetOffMyLine,2022-10-19 12:56:40,12,climatechange
where can I start to learn about the truth around climate change?,gamerlololdude,2022-11-04 16:06:20,19,climatechange
Does Space Science/Exploration help Climate Change?,InternalEmergency480,2022-08-13 05:43:07,6,climatechange
"Understanding hurricanes and climate change - ""Even though a warm ocean is a key ingredient for hurricane formation, research shows this warming has not significantly influenced the number of Atlantic hurricanes that form each year""",technologyisnatural,2022-06-08 19:25:57,16,climatechange
Could we counteract climate change by stimulating a volcanic eruption somewhere?,aquilus-noctua,2022-10-16 09:37:50,6,climatechange
Climate Change Is Already Taking Its Toll On Farmers (And You) - Early Chirp,EarlyChirp,2022-11-21 09:54:00,65,climatechange
Basic Global Warming Argument,wanerious,2022-09-14 12:30:03,68,climatechange
Just found out family don’t believe in Global Warming. Need help debating/convincing them.,berryfilthy,2022-03-08 14:42:20,57,climatechange
Is climate change not a natural cycle? (That we are obviously accelerating) Generally curious.,FadesGaming,2022-08-16 10:48:00,3,climatechange
Climate summit COP26: Climate researchers warn of drastic global warming,wilmots1,2021-10-31 08:51:42,31,climatechange
"Renowned German Desert Researcher: deserts grow but not because of climate change, warming will cause greening of Sahara, denies the existence of ""climate refugees"", criticizes scare mongering (German podcast)",Feldheld,2019-10-13 04:17:26,1,climatechange
Why do people only talk about the negatives of climate change?,ShotBot,2022-09-26 13:46:59,0,climatechange
Moving goal posts on global warming debate.,Successful-South-584,2021-12-12 16:16:35,31,climatechange
Can anyone help me with my report on How does environment conservation can play an important role in preventing climate change?,abhisheksinghabhi,2022-11-03 00:33:12,5,climatechange
"When did the climate warm near as fast or even faster than now, and why?",MokpotheMighty,2022-06-14 06:37:31,35,climatechange
Major new climate study rules out less severe global warming scenarios,WatchingDonFail,2020-07-23 18:20:54,87,climatechange
"Q: Why when it's warm it's ""Climate Change"" but when it's cold it's ""just weather fluctuations""?",BaconCatBug,2019-11-10 15:08:43,25,climatechange
Global Warming Potential should change the view on CO2,SeriousGuest,2018-12-06 15:29:40,7,climatechange
I got lost while trying to understand climate change,maryjonas,2022-03-06 07:06:09,60,climatechange
How do you feel about climate change?,funkypants223,2022-07-17 14:10:30,51,climatechange
Reason to Eliminate Fossil Fuels Beyond Climate Change,smitty_bubblehead,2022-08-05 11:20:26,18,climatechange
Does anyone have a rebuttal to this comment against human-caused climate change?,browserCookieMonster,2022-01-05 08:55:22,26,climatechange
More bad news for climate change. New data on Methane gas releases. Something I had considered but never thought how serious the source could be.,Umbra-Vigil,2022-11-10 23:59:42,49,climatechange
The world's oceans saw record warming in 2021 as climate change continues apace,adinaespinoza,2022-01-17 18:56:05,23,climatechange
"To date, is there any quantifiable progress on the efforts that humans have put in to fight climate change?",Anxious_City_7864,2022-03-12 10:59:47,37,climatechange
"Is this article bullshit?: ""These U.N. Climate Scientists Think They Can Halt Global Warming for $300 Billion""",Pervazoid2,2019-10-28 17:23:24,98,climatechange
Climate change: Threshold for dangerous warming will likely be crossed between 2027-2042,xrm67,2021-01-04 00:17:41,59,climatechange
Government climate scientists will study two geoengineering proposals to counteract global warming,MayonaiseRemover,2020-01-25 14:52:00,75,climatechange
Are the effects of climate change location specific?,mjw2714,2022-03-09 18:04:40,25,climatechange
"The Arctic Is Shifting to a New Climate Because of Global Warming: Open water and rain, rather than ice and snow, are becoming typical of the region, a new study has found",mubukugrappa,2020-09-15 16:19:21,87,climatechange
Will climate change cause the end of civilisations?,Ecology-boy-136,2021-12-10 18:35:20,67,climatechange
"What does the IPCC's Climate Change 2022: Impacts, Adaptation & Vulnerability WG2 report say?",adam-zopeful,2022-03-11 06:13:42,36,climatechange
Which climate innovations will really limit global warming?,Freeze95,2019-06-25 10:44:01,57,climatechange
Help me understand climate change on geologic timescales.,throwaway10008987,2021-10-18 19:30:38,21,climatechange
Needing some help calming my mind here. Global oxygen levels due to climate change.,datcarguy,2019-08-13 12:21:04,2,climatechange
Global warming from a climate sensitivity of 1.4°C (based on 24 different studies),Joel-Snape,2020-07-30 06:08:24,2,climatechange
Why sea level rise (SLR) is a better benchmark for climate change than global temperature (personal opinion).,buddhist62,2018-07-05 20:58:04,6,climatechange
Global warming,soHAam05,2020-10-15 04:21:19,69,climatechange
What’s beneath the Antarctica Polar Ice Caps? Are there species or land as part of biodiversity which will be affected by Climate Change?,Anxious_City_7864,2022-03-14 07:24:52,10,climatechange
"After year of climate disasters, world off-track to curb warming",The_Weekend_Baker,2022-12-07 06:54:34,69,climatechange
Climate change: Arctic warming linked to colder winters,boppinmule,2021-09-03 01:29:00,7,climatechange
"Climate change facts, solutions, and additional resources.",iboughtarock,2022-05-27 08:34:40,36,climatechange
Do you notice the climate changing that much in your countries?,Least_Big7057,2022-10-28 08:44:47,83,climatechange
How long have we known about climate change?,shevek94,2021-07-13 09:32:45,28,climatechange
A few questions about climate change as someone who has just began researching it lately?,density,2021-07-23 19:08:06,5,climatechange
is there any good news on climate change?,luvabxbyy,2021-07-29 03:45:43,102,climatechange
My father doesn’t believe in global warming and says it s all propaganda. What should i do about this?,AcrobaticBeginning4,2020-07-12 13:35:07,59,climatechange
Global warming may be twice what climate models predict,Steerpike13,2018-07-04 22:51:29,18,climatechange
Climate Change and Our Health: The Human Costs of a Warming Planet,mrgrassydassy,2021-06-13 12:48:10,5,climatechange
How do we get a real idea of the impacts of climate change?,condor1670,2022-03-30 20:26:29,2,climatechange
My dad thinks global warming is a hoax. Can someone please help me disprove this video he sent me.,Berbaw06,2020-02-12 18:24:46,61,climatechange
"Climate tipping points loom at 1.5 degrees of warming, new study warns",Strategic_Prussian,2022-09-10 04:18:31,90,climatechange
it's been 32 years since the first IPCC climate change report. Do we have know if it was overly pessimistic or optimistic?,Least-Leave9502,2022-09-26 16:12:51,56,climatechange
Is there a chance climate change really is just a cyclical event through the history of the world?,LookAtThatView,2021-08-30 13:19:57,0,climatechange
Climate change has always happened. Why is it bad?,thatsguy1975,2021-09-08 00:59:14,0,climatechange
Hemp Production Could Help Change the Trajectory of Climate Change,ReceptraNaturals,2021-07-08 09:47:06,64,climatechange
Solution to climate change?,TheRealGalek,2021-09-13 19:42:52,11,climatechange
"Climate change is warming long-frigid East Russia and allowing cultivation of corn, wheat and soybeans, building nationalist hopes that Russia will become one of the largest food producing nations in the world.",FERNnews,2020-12-21 13:52:15,8,climatechange
"Can anyone provide me with proof of a correlation between CO2 emissions, and a warming climate?",Chemicalweapon,2021-01-13 16:14:21,11,climatechange
"Today's G20 communique: ""pursuing efforts to limit the global temperature increase to 1.5°C will require meaningful and effective actions by all countries"". Doesn't this contradict the 2021 IPCC report: ""global warming of 1.5°C"" is ""more likely than not"" also in the most favourable scenario?",Marc_Op,2021-10-31 12:31:47,29,climatechange
Detailed timelines of expected effects of climate change needed,Molybdenum_Man,2022-08-03 13:41:26,4,climatechange
"I know climate change is a thing that people have caused and contributed to, but doesn't it also happen naturally?",Hamish4264,2021-03-25 21:07:12,5,climatechange
Nine lies about global warming,somepeopleskids21,2020-11-13 06:19:19,5,climatechange
Why is “global warming” our biggest focus environmentally?,ntalwyr,2019-09-02 23:50:10,37,climatechange
The questions on climate change that people are struggling to understand,RunnerPakhet,2022-07-20 07:15:02,39,climatechange
What climate skeptics taught me about global warming,uninone,2018-04-04 07:32:20,15,climatechange
Why would Southern California experience drought instead of increased precipitation in a global warming scenario?,rotopantalon,2021-01-09 08:13:13,7,climatechange
"Climate Change Could Fuel the Spread of a Flesh-Eating Parasite — Scientists caution that as the planet warms, more Americans could be exposed to varieties of the _Leishmania_ parasite.",Molire,2021-06-27 21:26:42,24,climatechange
Global Warming Is Pushing Microbes into Damaging Climate Feedback Loops & Raising Health Risks,KeybladeAxel19,2019-06-18 14:56:49,5,climatechange
"Thoughts on the Milankovitch Cycle, and the global warming arguments surrounding it? (Human activity deniers???)",TooneyChaos,2021-10-11 19:57:37,6,climatechange
Global Warming Pushes Microbes into Damaging Climate Feedback Loops,navegar,2019-06-22 15:57:20,9,climatechange
"Global Warming May Actually Be Twice As Hot As Climate Models Projected - an international team of researchers from 17 nations noted in the new research. The team saw that there are “amplifying mechanisms,” not well-represented in climate models.",jsalsman,2018-07-08 21:53:44,35,climatechange
Extreme climate change in the United States: Here are America's fastest-warming places,besselfunctions,2019-08-13 10:48:56,70,climatechange
What are some of the advantages of setting mitigation targets (such as 1.5 or 2 degrees of warming) to combat climate change?,bigmeme69,2020-08-03 21:05:05,4,climatechange
What can I do to help stop or push towards fixing Climate Change?,DimondAlo65,2021-08-17 07:11:14,8,climatechange
Time line for Climate Change being a known problem. 1859 - 2021,Kn0tnatural,2021-02-17 11:37:03,10,climatechange
Scientists see fingerprint of warming climate on droughts going back to 1900,Freeze95,2019-05-05 07:20:46,64,climatechange
Role Of Technology In Climate *science*,JustAHomoSepian,2022-10-04 22:08:13,3,climatechange
Climate Change: A Technological Approach?,Various_Preceptions,2021-04-10 15:22:24,3,climatechange
U.N. climate panel confronts implausibly hot forecasts of future warming,kytopressler,2021-07-28 17:27:02,67,climatechange
I'm doing a school project on the logical fallacies and rhetorical strategies used by climate change deniers on the internet. Could you guys direct me to any big climate change denial forums or blogs that you are familiar with?,Potter3068,2020-11-18 08:48:22,40,climatechange
scientific approach to climate change vs covid,morecoffeemore,2021-04-06 13:13:52,1,climatechange
Climate change: Electrical industry's 'dirty secret' boosts warming,boppinmule,2019-09-13 14:49:28,4,climatechange
Response to all climate denier.,Efficient-Debate-487,2022-11-08 00:26:07,69,climatechange
Global Warming Likely to Be 30 to 45 Percent Lower Than Current Climate Models Project,technologyisnatural,2018-05-18 16:20:07,0,climatechange
What happened? I really didn't think climate change denial was as prevalent as it seems to be.,_suited_up,2018-12-06 01:50:10,26,climatechange
Why would we allow runaway climate change to happen if geoengineering is possible?,t0mkat,2022-06-16 17:22:47,4,climatechange
'Nowhere to hide': South Pole warms up with climate change a factor,Newman1651,2020-06-30 09:44:13,89,climatechange
I have a Question about Climate Change,OriginalGravyBones,2021-02-12 14:16:55,1,climatechange
"""Finnish study finds 'practically no' evidence for man- made climate change""",MichiganMemory,2019-07-26 06:31:10,68,climatechange
Climate change,Affectionate-Fact-17,2020-12-03 09:44:40,10,climatechange
Is the public properly educated on climate change?,Bj231,2019-04-28 09:13:37,45,climatechange
American Family Association is a dangerous source of climate change denial propaganda,erotomania44,2020-01-11 19:36:45,33,climatechange
[Civil Discussion] Help convince me Global Warming is a significant issue.,Corksters,2018-12-04 05:07:14,4,climatechange
Nuclear (Fission and Fusion) is almost as bad as Oil/Coal Fire Power Generation for the environment. Enclosed are the only viable solutions for climate change friendly power production.,ElitePVP86,2021-02-02 14:45:47,0,climatechange
What are your ideas for explaining the science of climate change as easily as possible?,themonkery,2019-06-16 07:25:15,19,climatechange
"If the water system is closed=loop, does a warming climate mean less water?",TheLastSamurai,2021-06-25 17:40:35,4,climatechange
"Genuine Question: Is it not coincidental that climate change and our need to shift to renewable energy, comes at a time where fossil fuel supply will run out?",mblessing1989,2021-08-11 08:48:17,1,climatechange
Climate Change Trends,armadiyo-42,2020-12-05 01:10:33,9,climatechange
Is climate change suppose to happen? Palm trees in Antarctica?,ArcadianScientist,2020-09-05 05:28:16,0,climatechange
"UK's 10 warmest years all occurred since 2002 - The patterns of warm and cold years in Britain are a clear signal of climate change, say scientists.",danpick,2019-07-31 05:50:42,77,climatechange
My professor tasked me with finding the best anti-climate change theory out there. Any ideas where to look?,butt_shrecker,2018-02-26 21:36:57,11,climatechange
Is there a limit to how bad climate change can get?,sleep_like_the_dead,2021-09-04 23:13:19,16,climatechange
Is this true regarding US climate carbon emissions and climate change?,Joker4U2C,2019-11-06 13:08:31,2,climatechange
Increasing the resilience of plant immunity to a warming climate,LoganMorganqc,2022-07-04 11:40:27,26,climatechange
Environmentalists Warm to Nuclear Power Amid Climate Change Threat,climate_fiction_guy,2018-11-16 16:12:32,31,climatechange
What's the timeline on global warming (estimates)?,CalmDownLittleBrain,2018-11-04 11:57:47,1,climatechange
Global warming will make Earth superhabitalbe,benignoak,2020-10-12 04:01:12,0,climatechange
A thought about climate change.,shitozi,2019-06-23 20:55:53,0,climatechange
How big impact do forest fires have to global warming compared to emissions from humans?,omichaelsen,2019-08-09 22:27:13,4,climatechange
Can confirm climate change is 100% real,El-taquito,2020-11-21 01:51:41,0,climatechange
Why I’m skeptical with climate change,Sylveon_Fan,2019-02-16 14:48:53,5,climatechange
"I don't know what climate change is, and I've been ignorant about it for so long that I've been too afraid to ask...until now.",ygnomecookies,2019-01-03 08:35:20,33,climatechange
George Carlin on Climate Change/Global Warming?,Xkilljoy98,2022-06-29 10:38:59,9,globalwarming
Has anyone any sources/articles....,wolfgirlspy,2019-03-14 17:54:19,6,globalwarming
Climate change and global warming survey for English Language coursework.,ShaunKulesa,2022-08-30 05:29:14,5,globalwarming
To beat climate change and slow global warming we need to take action!!,redaijedi,2022-04-21 05:17:06,13,globalwarming
I think everyone has been wrong about the reasoning behind global warming and climate change. Hear me out,bigdaddyblake69420,2020-09-30 18:13:32,0,globalwarming
"I know (because I'm not an idiot) that global warming and climate change is real, but this made me realise how bad it is.",JackFromTheHill,2019-07-22 11:40:16,15,globalwarming
How do you think global warming / climate change / earth changes / whatever will impact YOU / your area? Within 15 years...,earthcomedy,2019-09-06 00:26:21,9,globalwarming
Global warming is going to happen. We can’t stop it.,markd90638,2022-11-15 11:45:13,14,globalwarming
Made this video for my Digital Writing and Social Change class to help spread awareness about climate change and global warming.,ahunt32,2019-05-02 13:25:10,22,globalwarming
Understanding the consequences of global warming,mestermestermester,2022-11-06 03:28:17,12,globalwarming
"researchers found that previous periods of climate change such as the Little Ice Age and the Medieval Warming Period were regional and not a global phenomenon. In contrast, the warming that has occurred over the past century has been far-reaching and global in nature.",arcticouthouse,2019-07-25 06:07:45,24,globalwarming
How global warming and La Niña fueled a summer of climate extremes,wewewawa,2022-09-17 15:57:24,13,globalwarming
6 Ways Climate Change Affects the Economy. Global Warming Economics,jimmytwoshoes420,2019-07-17 23:02:11,15,globalwarming
Last 12 Years to the End of the World! Global warming and climate change,hbakmis,2018-11-05 12:41:26,2,globalwarming
How Well Do Scientists Understand Global Warming? | Climate Change on America Uncovered,SlovenianCat,2019-05-25 07:04:18,0,globalwarming
How badly is Japan’s economy going to be affected by Global Warming?,Seven1s,2022-10-31 06:06:18,11,globalwarming
Global Warming Science Experiment for Education / Evidence,nicholascox2,2022-09-26 16:20:50,4,globalwarming
"The Rate of Global Warming During Next 25 Years Could Be Double What it Was in the Previous 50, a Renowned Climate Scientist Warns",quarry,2022-05-27 01:31:41,24,globalwarming
Top climate scientists are sceptical that nations will rein in global warming,LoganMorganqc,2021-11-04 09:54:09,33,globalwarming
?QUESTION?: The UN climate report states that now there is proof for human influence in regards to global warming,reppien,2021-08-10 10:08:58,2,globalwarming
I am debating someone on twitter regarding global warming and they linked a study,ethiopianboson,2022-01-26 10:10:08,11,globalwarming
"Can the USA's government reverse global warming, and if so, how?",emeyer4444,2021-09-14 03:36:24,39,globalwarming
Climate change measures are a lot more popular than Americans think,TrueConservative001,2022-09-04 16:25:27,30,globalwarming
Good podcast that discusses how global warming impacts our health.,ItsTheTenthDoctor,2022-04-13 09:34:20,16,globalwarming
Could Global Warming be a Natural Climate Process of Earth?,ddjh5,2019-01-14 19:04:32,1,globalwarming
We have little effect on Global Warming,UnderTheCoversGinger,2022-07-16 01:12:38,0,globalwarming
