title,username,date,upvotes,subreddit
Stopping climate change and global warming.,BillyDog1998,2019-02-08 04:45:45,1,environment
Climate change: IPCC scientists say its; now or never; to limit warming,FallonLundquist36,2022-04-10 12:00:30,699,environment
"Humanity is ""going in the wrong direction"" on climate change due to its addiction to fossil fuels, the UN said Tuesday in an assessment showing that planet-warming emissions are higher than before the pandemic",DoremusJessup,2022-09-13 12:58:54,175,environment
"School lessons targeted by climate change doubters. As climate change becomes a hotter topic in American classrooms, politicians around the country are pushing back against the solid scientific consensus that global warming is real, dire and man-made.",Wagamaga,2019-03-06 13:58:33,15,environment
"The United States, despite withdrawing from a landmark accord aimed at curbing climate change, is stonewalling vital UN talks in a row over how poorer nations' battle against global warming is funded",Wagamaga,2018-09-08 03:16:15,11,environment
Exceeding 1.5°C global warming could trigger multiple climate tipping points - Science,233C,2022-09-09 05:48:28,40,environment
Direct air carbon sequestration made more feasible with this new lab grown mineral breakthrough,Frubanoid,2018-08-14 22:23:32,8,climate_science
"The Arctic and the Third Pole - Himalaya regions are at the frontlines of climate change, warming at a rate 2-3 times faster than the global average",ShovelingSnow,2022-07-01 08:06:13,40,climate_science
"Are the fires in Australia related to global warming and climate change? If so, how?",Gillcavendish,2020-01-06 17:36:08,1,climate_science
Clarification on terms: global warming vs climate change,SeeMonkeyDoMonkey,2018-01-28 07:06:14,3,climate_science
Jetstream Climate Analysis - Scotland Jet Stream X Global Warming,twistedfairyprepper,2019-10-10 05:02:41,13,climate_science
"The Arctic Is Shifting to a New Climate Because of Global Warming: Open water and rain, rather than ice and snow, are becoming typical of the region, a new study has found.",nnomadic,2020-09-14 15:52:48,50,climate_science
New study shows current climate pledges might limit warming to 2 degrees Celsius,unknown_travels,2022-04-14 10:55:59,32,climate_science
"Scientists have analyzed over 12,000 years of climate data, and found that human-induced warming interrupted and reversed a long-term natural global cooling period. 1,319 data records from samples like lake deposits, marine sediments, were collected from 679 sites around the world.",Fungus_Schmungus,2020-07-01 10:08:31,68,climate_science
Analysis: How well have climate models projected global warming?,Capn_Underpants,2019-07-12 06:35:41,27,climate_science
"Climate change facts, solutions, and additional resources.",iboughtarock,2022-05-27 08:32:17,65,climate_science
Global warming may be twice what climate models predict,Steerpike13,2018-07-04 22:50:34,26,climate_science
"Global Warming May Actually Be Twice As Hot As Climate Models Projected - an international team of researchers from 17 nations noted in the new research. The team saw that there are “amplifying mechanisms,” not well-represented in climate models.",jsalsman,2018-07-08 21:26:34,19,climate_science
Are there any studies which suggest that successful efforts to combat global warming could cause a positive feedback loop for global cooling?,UT_Teapot,2020-07-20 04:25:16,26,climate_science
"Climate change-driven droughts are getting hotter, study finds: Temperature increases during dry periods outpace average climate warming",gmb92,2018-08-07 10:56:48,16,climate_science
"'40 New Scientific Papers Disprove Climate Change... etc etc.' I suspect this is nonsense, but how do I interpret these studies cited?",BreaksFull,2019-05-28 04:59:55,35,climate_science
Reliable tropical weather pattern to change in a warming climate,Fungus_Schmungus,2019-01-02 09:12:07,8,climate_science
Warm Holes & Cold Blobs in the North Atlantic due to climate change - interview with Paul Keil (Max Planck Inst. for Meteorology) on his research paper looking at the area of cold water forming in the N Atlantic & how it is linked to rising CO2.,NickGBreeze,2020-07-24 05:11:47,18,climate_science
The Role Of Nuclear Energy In Limiting Global Warming.,ThanksIllPass,2019-07-21 17:41:33,9,climate_science
Help me rebut these points from a climate change denier,I_Name_Your_Bong,2018-10-26 13:53:52,16,climate_science
"Dear experts, one recurring theme of climate models published over the past 2 decades seems to be ""faster warming than expected"". What's your gut-feeling about this?",bqpg,2018-08-08 02:18:02,15,climate_science
Peer-Reviewed Studies on the Climate Change Link to Wildfires,gmb92,2018-08-29 02:05:52,25,climate_science
New research in GRL says poor countries will feel climate change first,Steerpike13,2018-05-29 16:43:20,7,climate_science
"Is a stable climatic state with a Northeastern Asia with far warmer, wetter winters possible? More generally, is climate almost fully geographically/orbitally determined, or is it possible for alternate stable climate states to exist?",GrantExploit,2022-03-21 03:33:32,15,climate_science
Best place in Europe to settle if you are concerned about a warming planet?,nomadic_canuck,2021-07-08 16:07:10,48,climate_science
"Discussion about the paper, ""Well below 2 °C: Mitigation strategies for avoiding dangerous to catastrophic climate changes,"" PNAS 2017, by Yangyang Xu and Veerabhadran Ramanathan.",naufrag,2019-07-25 15:25:14,36,climate_science
Hi! I need help getting data to show projections of the trends of climate change in the future affected by our active solutions,its_the_Guy_there,2018-05-14 16:51:23,6,climate_science
Study Confirms Climate Models are Getting Future Warming Projections Right,Fungus_Schmungus,2020-01-11 12:29:40,71,climate_science
How will climate change affect winter storms and swell?,bottles24,2020-07-25 09:33:34,7,climate_science
Climate sensitivity based on models vs ice core data,Sabiba,2020-08-01 20:00:36,21,climate_science
New climate models forecast a warming surge,rrohbeck,2019-04-19 14:46:39,29,climate_science
Quantifying global cooling due to anthropomorphic sulfate emissions,Octagon_Ocelot,2018-09-02 10:31:45,16,climate_science
More detail on slowing of ocean circulation due to climate change,Steerpike13,2018-05-28 17:33:54,16,climate_science
"Some climate deniers are saying that during the last Glacial Minimum, that temps were nearly 3 degrees C higher than pre-industrial levels. Is this true? If not then how high did temps get between glacial periods?",UT_Teapot,2020-07-18 19:14:00,18,climate_science
"How to respond to claims made by a ""sceptic"" atmospheric physicist?",In_der_Tat,2021-07-29 09:12:45,43,climate_science
"Discussion of atmospheric methane sources and sinks, and their reactions to a warming climate",SerraraFluttershy,2018-04-27 21:22:25,13,climate_science
Climate sensitivity studies since the last IPCC report point towards a higher lower bound,gmb92,2018-03-28 12:00:19,24,climate_science
Possible climate transitions from breakup of stratocumulus decks under greenhouse warming,horacetheclown,2019-02-25 14:24:19,3,climate_science
Sustained climate warming drives declining marine biological productivity,SvanteArrheniusAMA,2018-03-09 04:57:03,12,climate_science
On the time evolution of climate sensitivity and future warming,SvanteArrheniusAMA,2018-09-25 04:19:24,6,climate_science
Continental-scale decrease in net primary productivity in streams due to climate warming,SvanteArrheniusAMA,2018-05-22 04:24:48,7,climate_science
The many possible climates from the Paris Agreement’s aim of 1.5 °C warming,SvanteArrheniusAMA,2018-06-07 02:05:18,6,climate_science
What actually is global dimming?,tubbsmackinze,2018-09-27 12:01:34,6,climate_science
"Why does the ""warming"" effect get worse as greenhouse gases rise to higher elevation?",ILostMyEmpire,2018-05-29 10:10:45,4,climate_science
"A discussion about and new model on whether Mars had a ""warm and wet"" or a ""cold and icy"" past climate, featuring Brown University's Ashley Palumbo. (WeMartians Podcast)",wemartians,2018-06-12 08:57:36,11,climate_science
Climate research related notes for a short film,TORM3NTO,2021-07-22 12:45:56,29,climate_science
Is weather forecasting dropping behind in it's ability to forecast as the climate heats up and weather patterns speed up?,Arowx,2019-03-07 07:27:18,9,climate_science
Climate sensitivity studies since the last IPCC report point towards a higher lower bound: Update and Further Discussion,gmb92,2018-08-08 18:26:15,17,climate_science
Complete newbie looking to learn more - Really appreciate any insights.,Tilasir,2019-10-30 19:46:02,13,climate_science
The Holocene temperature conundrum,DrDolittle,2019-11-26 04:44:41,9,climate_science
89% of NWS/NOAA temperature station data is likely compromised from being in close proximity (<30m) of artificial heat sources,sadelbrid,2019-12-05 19:37:24,0,climate_science
1980-2003 Natural variation in latent heat flux,DrDolittle,2020-02-06 02:41:19,22,climate_science
If we can't stop it.,Chango-the-burrito,2019-08-18 11:33:54,9,climate_science
Tipping points: when does a 10% chance become a 100% certainty?,Tliish,2021-07-28 17:34:51,45,climate_science
Does lightning cool the atmosphere down or heat it up more?,Arowx,2018-07-26 06:20:33,6,climate_science
Can any one explain and link the study that this independent article talks about?,tubbsmackinze,2018-09-18 00:08:14,2,climate_science
"Question regarding implications of paper: ""Strengthening tropical Pacific zonal sea surface temperature gradient consistent with rising greenhouse gases""",humanistactivist,2019-07-22 14:01:34,12,climate_science
"Do places besides Wellington have three seasons? Warm, cool and windy?",courtenayplacedrinks,2019-12-22 02:02:06,12,climate_science
A request for a short e-mail interview.,Cmdrdata364,2018-02-24 15:03:46,6,climate_science
Should Working Group III be a part of the IPCC?,naufrag,2019-10-04 13:41:05,32,climate_science
How valid is this article from the guardian claim?,tubbsmackinze,2018-09-23 14:01:36,6,climate_science
Is Stratospheric Aeorosol Injection really viable?,soqqerbabe27,2019-01-07 13:23:55,9,climate_science
Sea Surface Temp Recalculation?,trustintruth,2018-05-29 22:39:53,6,climate_science
Blue Ocean Event,revenant925,2018-09-30 11:31:56,12,climate_science
Read an article that has made me question a few assumptions - would love to know how to counter these points.,JabroniBalogna88,2018-05-21 18:46:13,0,climate_science
"If you listen, you can almost hear the liberals...""global warming, climate change, global warming, climate change...""",hickfield,2020-06-01 19:26:41,166,climateskeptics
"Hurricane Florence isn't the result of climate change, global warming",barttali,2018-09-14 11:22:36,26,climateskeptics
Stefan Molyneux interviews Lord Monckton on climate change/global warming,tifuforreal,2018-05-21 17:20:18,11,climateskeptics
"The daily express takes a break from ranting about aliens, homosexuals, left handed people, celebrities showing cleavage, and asteroid strikes due to happen every single week, to warn us that climate change will now make turbulence worse. It’s appropriate these nutters are now climate alarmists.",RealAlcibiad3s,2019-08-09 12:31:06,23,climateskeptics
NASS misrepresenting Climate Data,VBahardearnedthirst,2019-10-17 10:45:21,7,climateskeptics
Curious about Skeptic POV,splattlee,2021-09-29 12:09:35,0,climateskeptics
Would Ecuador need to be threatened by glaciers for this global warming/climate change scam to come to an end?,Left_Insanity,2022-11-28 02:57:43,49,climateskeptics
Humans aren't causing global warming / climate change. So what is?,I_likeIceSheets,2022-11-19 14:08:00,0,climateskeptics
any other thoughts on these environmental ethical dillemas?,kikibo22,2020-01-16 20:06:52,0,climateskeptics
Magnetic north pole movement,Squidcg59,2019-02-09 14:49:09,1,climateskeptics
We Have Climate Change But Where Did The Global Warming Go?,logicalprogressive,2022-06-05 16:02:04,31,climateskeptics
Climate Change Just Got Real: Dutch Police Shoot Live Ammo At Anti-Climate Rule Protesters to Make Them Believe In Global Warming,logicalprogressive,2022-07-07 14:26:22,75,climateskeptics
Global Warming Insanity: Navy Holding Climate Change Wargame,logicalprogressive,2022-06-21 20:36:30,6,climateskeptics
"Met Office Changed Global Temperature Record to Add 14% to Recent Warming, Says Climate Scientist",LackmustestTester,2022-05-01 11:51:17,66,climateskeptics
Is Anthropogenic Global Warming Accelerating? - Journal of Climate,_Angstrom_,2022-12-21 06:05:40,4,climateskeptics
Western Ghats; Thoughts on Climate Change and Global Warming - LOST ON HISTORY,dk987,2022-07-04 02:20:38,5,climateskeptics
"Having Run Out Real Global Warming, Alarmists Blame Fictional Future Weather on Climate Change",logicalprogressive,2021-12-25 15:51:26,35,climateskeptics
"Here’s to global warming, I mean global cooling, I mean the hole in the ozone layer is going to kill us all, I mean climate change.",dallenr2,2021-04-20 09:37:26,141,climateskeptics
B-but global climate warming/cooling/change is serious business...,BoondockSaint45,2020-01-10 16:32:43,427,climateskeptics
Global Warming Went Missing 8 Years Ago - Climate Alarmists Are Desperate,logicalprogressive,2022-11-04 15:54:10,47,climateskeptics
Climate alarmism is all about killing capitalism and replacing it with socialism. “Climate change” is the vehicle to rally useful climate idiots. Forget everything you think you know about global warming. The truth is that it’s not about carbon—it’s about capitalism.,optionhome,2019-07-23 13:29:46,167,climateskeptics
"50 years of failed predictions that the climate disaster is just around the corner due to new Ice Age, Global Warming, or Climate Change. Take your pick",optionhome,2021-11-13 05:01:07,14,climateskeptics
Marc Morano: Goal of UN Global Climate Warming Change Report is to ‘Scare Everyone’,logicalprogressive,2021-08-10 21:55:12,19,climateskeptics
The Guardian: Fake climate news you can trust. Telling lies and spreading propaganda since 2007 – when it was still known as ‘global warming.’,Left_Insanity,2022-10-24 06:35:38,128,climateskeptics
"NASA scientist James E. Hansen, who has publicly criticized the Bush administration for dragging its feet on climate change and labeled skeptics of man-made global warming as distracting “court jesters,” appears in a 1971 Washington Post article that warns of an impending ice age within 50 years.",greyfalcon333,2021-01-02 19:46:03,11,climateskeptics
The Truth Explained: Why and When “Global Warming” was rebranded “Climate Change”,ClassicSoulboy,2020-05-16 05:16:41,51,climateskeptics
Global Warming: All-Time Cold Records Fall In Australia & Solar Activity Controls The Climate,LackmustestTester,2022-07-05 14:06:04,58,climateskeptics
a genuine qeustion have any of you faced any hate or bullying since you dont fully belive in global warming/climate change?,Porkytheking4555,2020-11-22 21:08:30,6,climateskeptics
"UN: Too little of recovery spending fights climate change. Nations are spending unprecedented amounts of money to bounce back from the pandemic and the economic shock it triggered, but less than one dollar out of five spent so far will help fight global warming.",Crabcakes5,2021-03-11 17:47:54,2,climateskeptics
There is no evidence that 'global warming' was rebranded as 'climate change',SftwEngr,2020-03-12 15:13:52,17,climateskeptics
THE CATASTROPHIC ANTHROPOGENIC GLOBAL WARMING (CAGW) AND THE HUMANMADE CLIMATE CHANGE CRISES ARE PROVED FALSE,romark1965,2020-06-12 05:03:18,33,climateskeptics
"A query repeats another by climate change sceptics: If global warming is happening, why is it colder in some places than earlier years?",sherlockhasan09,2021-01-16 23:03:09,0,climateskeptics
Global Warming not Climate Change.,Prophetica2020,2020-02-15 15:45:59,24,climateskeptics
"Hello I'm a physicist, convince me that global warming and climate change aren't occurring",Qdothms,2020-02-02 03:45:55,0,climateskeptics
"Climate change? - Simply explained: More CO₂ leads to an unstoppable global warming, absolutely",LackmustestTester,2020-05-10 16:33:55,13,climateskeptics
Climate Change and Global Warming,Kim147,2019-05-17 18:40:31,15,climateskeptics
Majority of Americans unwilling to pay $10 per month to address climate change despite high belief in global warming,climate_control,2019-01-24 17:44:55,70,climateskeptics
"21st Century Warming Trend Change May Not be Due to Greenhouse Gasses, Leading Climate Scientists Say",LackmustestTester,2022-12-16 11:54:31,14,climateskeptics
"The Global Warming Cult Has Developed A High Protein Food Product They Claim Will Help Stop Climate Change, They Call It 'SOYLENT GREEN'",propshaft,2019-09-10 13:22:51,32,climateskeptics
"Climate change, or, to put it more specifically, global warming, is not fake. Fight me",farsighted23,2019-07-25 06:29:19,0,climateskeptics
It's Indisputable Empirical Evidence: Trump's Policies Are Slowing Global Warming & Climate Change,LackmustestTester,2020-08-08 13:43:22,8,climateskeptics
"Climate Change & Global Warming Are Natural, Not A Result of CO2",LackmustestTester,2020-08-21 15:14:45,6,climateskeptics
Climate change whistleblower alleges NOAA manipulated data to hide global warming ‘pause’,romark1965,2019-09-16 15:01:24,42,climateskeptics
"‘Greenhouse Gas Effect Does Not Exist,’ a Swiss Physicist Challenges Global Warming Climate Orthodoxy",SftwEngr,2022-07-31 02:14:13,48,climateskeptics
"“Here she is preaching on global warming and saying that we’ve got to do something about climate change,” Jones said. “The fact is New Zealand’s carbon dioxide has grown by 10.8 per cent per capita since 1990. Ours has grown by 1.8 per cent.",LCFarm,2019-08-15 23:44:25,27,climateskeptics
Climate Activists Are Dancing For Joy: No Global Warming For 7 Years 11 Months Now,logicalprogressive,2022-08-02 19:27:38,52,climateskeptics
The Goodness of Global Warming - Today’s Mildly Icy Climate in Perspective,LackmustestTester,2022-12-14 13:40:44,1,climateskeptics
DEBUNKING The MANY LIES Of Eco-Fascists And The Global Warming/Climate Change Movement,DontStopMeNowPeople,2020-06-23 07:58:45,55,climateskeptics
Hockey Stick Goes Limp: Climate Alarmists Respond to the Global Warming Pause,logicalprogressive,2022-07-21 19:14:31,27,climateskeptics
"'Greenhouse gas effect does not exist,' a Swiss physicist challenges global warming climate orthodoxy",Additional_Common_15,2022-07-31 16:38:57,21,climateskeptics
A Bit of History - Global Warming and Climate Change,Kim147,2020-10-13 19:23:09,8,climateskeptics
Are you a Global Warming atheist/agnostic/heretic? Share your story of converting from a true believer in the pseudo-religion of climate change into a nonbeliever.,ITotallyBelieveYou2,2019-08-16 14:32:45,7,climateskeptics
If these climate change cultists really believe global warming is going to destroy humanity why aren't THEY investing in renewable energy?,ultimaregem,2018-11-12 21:04:29,18,climateskeptics
Got Your Global Warming Forecast Wrong? No Problem – Blame Climate Change,nsfsf,2019-06-13 12:30:04,36,climateskeptics
Global Warming: A New Study Could Destroy Doomsday Climate Change Forecasts,buzzly6,2018-04-10 08:52:02,32,climateskeptics
Big Picture Friendly Reminder: Draconian UN Climate Agenda Exposed - ‘Global Warming Fears Are A Tool For Political and Economic Change…It Has Nothing To Do With The Actual Climate’,ClassicSoulboy,2020-05-14 00:59:19,22,climateskeptics
“Climate Change” out: it’s Global Warming again because it’s more scary,Kim147,2020-01-27 17:25:23,12,climateskeptics
"(PDF) ""Global warming"" vs. ""climate change"" meaningless rhetoric to cover up much colder climates. ""Climate has been changing for billions of years."" Sea levels declined recently with sharp drop in global temperatures 2016. | James G Matkin - Academia.edu",igottashare,2019-08-04 10:02:38,25,climateskeptics
Is the evidence for climate change different from the evidence for global warming?,jackryan147,2020-01-05 21:16:44,0,climateskeptics
"Astrophysicist Joseph Postma (author of ""In the Cold Light of Day"") Debunks Mainstream Global Warming - Climate Change 17 min",acloudrift,2019-01-18 12:02:29,18,climateskeptics
"Climate change deniers’ new tactic to influence the future: “there is an attempt being made by them to deflect attention away from finding policy solutions to global warming towards promoting individual behaviour changes that affect people’s diets, travel choices and other personal behaviour”",blaspheminCapn,2019-11-09 21:31:10,5,climateskeptics
"Climate change: Bangkok, Amsterdam and Melbourne 'face greatest global warming risk' | Climate News",beanitto,2020-02-12 21:18:08,2,climateskeptics
Climate change or global warming?,jerempistien,2019-08-23 16:29:59,1,climateskeptics
"Global Warming vs Climate Change and the ""Hoax""",AbstractTherapy,2018-04-07 15:55:53,9,climateskeptics
Astrophysicist Debunks Mainstream Global Warming / Climate Change Narrative FOREVER,Kim147,2019-03-07 04:51:25,32,climateskeptics
"Climate Change group makes a ""joke"" about a school teacher murdering her students who don't believe the global warming indoctrination",123bigtree,2019-03-27 11:17:25,7,climateskeptics
Use of ‘Too Hot’ Climate Models Exaggerates Impacts of Global Warming,LackmustestTester,2022-05-06 13:15:15,63,climateskeptics
Motivations Behind and Beyond Global Warming/Climate Change,propshaft,2019-09-19 13:28:04,5,climateskeptics
We were told there'd be droughts due to climate change. That's not happening. Indeed it turns out lakes are growing in size and that's bad for... climate change,lusboy,2022-12-13 16:08:20,23,climateskeptics
"The Little Ice Age Wasn’t Global, but Current Climate Change Is: None of the cold and warm epochs from the past 2,000 years were global events, but the current period of climate change is more intense and is happening simultaneously across the entire planet.",GlobalClimateChange,2019-07-24 16:33:07,2,climateskeptics
What do you think about how nicely the climate conditions of the Medieval Warm Period and the Little Ice Age debunk the false claim by climate alarmists that global warming is harmful to humans and that fossil fuels and carbon emissions cause it?,Pietro5J164,2022-04-20 21:33:20,40,climateskeptics
Global Warming Science Theology: White Evangelicals Have Sold Their Souls on Climate Change,logicalprogressive,2018-04-06 20:07:35,8,climateskeptics
The case for spraying (just enough) chemicals into the sky to fight climate change: new study says geoengineering could cut global warming in half — with no bad side effects.,CultistHeadpiece,2019-03-14 08:04:18,2,climateskeptics
How Well Do Scientists Understand Global Warming and Climate Change? (simple explain) | AmerUncvd 16 min,acloudrift,2019-03-14 19:05:35,6,climateskeptics
"Bad News For Climate Alarmism: Global Warming Of 4.9°C Will Make The Earth Greener, Not Browner",LackmustestTester,2022-02-21 14:08:26,96,climateskeptics
Climate change: How could artificial photosynthesis contribute to limiting global warming? Scientists calculate areas needed for forestation and artificial photosynthesis,ruiseixas,2019-02-23 05:33:09,6,climateskeptics
"Weather, Climate, Carbon Dioxide and Global Warming. — No level of carbon taxes or emission targets will stop Earth’s climate from changing. Nature rules, not politicians. We must aim for resilience, but be prepared to adapt.",Clatsop,2018-05-02 08:34:39,31,climateskeptics
"When pollsters realized the public and elected officials weren’t buying global warming as a concept or policy, in a brilliant political move, they came up with the phrase “climate change.” This helped sell the theory of man-made global warming.",optionhome,2019-04-13 08:14:00,0,climateskeptics
"BBC climate editor made false claims on global warming for Panorama broadcast, inquiry finds",schnauzergambit,2022-05-10 05:28:29,46,climateskeptics
Climate Scientist Joe Biden Finds Link Between Global Warming And Tornadoes,logicalprogressive,2021-12-11 23:03:27,51,climateskeptics
One Health: Trojan Horse to Make Climate Change a 'Global Health Emergency' - 21st Century Wire,SftwEngr,2022-06-29 18:27:42,7,climateskeptics
“Global warming” is out. “Climate catastrophe” is in.,LackmustestTester,2021-12-06 18:24:57,132,climateskeptics
"Might be older, if earth spins FASTER its global warming and if it SLOWER it global warming!",MichaelAChristian,2022-12-19 23:13:38,1,climateskeptics
Climate models have not exaggerated global warming - Except when they do…,logicalprogressive,2022-05-09 20:20:47,11,climateskeptics
Random Dangers of Climate Change,LackmustestTester,2022-12-23 11:37:10,6,climateskeptics
Ask ClimateSkeptics- Academics can massage data to fit their political preferences. Is there any independent Ocean /satellite data that shows global warming?,Internet-Fair,2021-02-24 07:49:13,21,climateskeptics
Would a 'War against pollution' be a easier sale?,IsItJustMeOrt,2019-10-03 11:14:01,4,ClimateOffensive
How a teen changed his stepdad's mind about global warming » Yale Climate Connections,ILikeNeurons,2020-12-24 01:45:12,323,ClimateOffensive
"Climate change deniers’ new tactic to influence the future: “there is an attempt being made by them to deflect attention away from finding policy solutions to global warming towards promoting individual behaviour changes that affect people’s diets, travel choices and other personal behaviour”",ILikeNeurons,2019-11-10 09:06:18,19,ClimateOffensive
